Symbol,Name,Last Sale,Net Change,% Change,Market Cap,Country,IPO Year,Volume,Sector,Industry
JZ,Jianzhi Education Technology Group Company Limited American Depositary Shs,$1.00,-0.07,-6.542%,20185000.00,China,2022,184,Real Estate,Other Consumer Services
JZXN,Jiuzi Holdings Inc. Ordinary Shares,$1.51,-0.03,-1.948%,13671537.00,China,2021,4567,Consumer Discretionary,Retail-Auto Dealers and Gas Stations
K,Kellanova Common Stock,$80.83,-0.05,-0.062%,27667122470.00,United States,,319065,Consumer Staples,Packaged Foods
KACL,Kairous Acquisition Corp. Limited Ordinary Shares,$12.38,0.00,0.00%,0.00,Malaysia,2022,362,Finance,Blank Checks
KACLR,Kairous Acquisition Corp. Limited Rights,$0.0971,-0.0151,-13.458%,0.00,Malaysia,2022,285,Finance,Blank Checks
KACLW,Kairous Acquisition Corp. Limited Warrants,$0.0168,0.0053,46.087%,0.00,Malaysia,2022,203,Finance,Blank Checks
KAI,Kadant Inc Common Stock,$319.50,3.05,0.964%,3752388198.00,United States,1992,3410,Industrials,Industrial Machinery/Components
KALA,KALA BIO Inc. Common Stock,$6.89,0.09,1.324%,31746150.00,United States,2017,10230,Health Care,Biotechnology: Pharmaceutical Preparations
KALU,Kaiser Aluminum Corporation Common Stock,$72.91,4.57,6.687%,1172911336.00,United States,,113527,Industrials,Metal Fabrications
KALV,KalVista Pharmaceuticals Inc. Common Stock,$12.19,0.51,4.366%,526796604.00,United Kingdom,2015,22925,Health Care,Biotechnology: Pharmaceutical Preparations
KAPA,Kairos Pharma Ltd. Common Stock,$1.3803,-0.0697,-4.807%,17725726.00,,2024,4651,Health Care,Biotechnology: Pharmaceutical Preparations
KAR,OPENLANE Inc. Common Stock,$16.38,0.26,1.613%,1779184887.00,United States,2009,32800,Consumer Discretionary,Retail-Auto Dealers and Gas Stations
KARO,Karooooo Ltd. Ordinary Shares,$39.41,-0.51,-1.278%,1217769000.00,Singapore,2021,8709,Technology,Computer Software: Prepackaged Software
KAVL,Kaival Brands Innovations Group Inc. Common Stock,$0.9872,-0.0254,-2.508%,6697123.00,United States,,147866,Consumer Discretionary,Other Consumer Services
KB,KB Financial Group Inc,$69.27,-2.91,-4.032%,26230043158.00,South Korea,,56902,Finance,Commercial Banks
KBDC,Kayne Anderson BDC Inc. Common Stock,$16.37,0.02,0.122%,0.00,,2024,1246,,
KBH,KB Home Common Stock,$79.71,1.66,2.127%,5845491162.00,United States,1986,133882,Consumer Discretionary,Homebuilding
KBR,KBR Inc. Common Stock,$67.235,0.485,0.727%,8958525870.00,United States,2006,150154,Industrials,Military/Government/Technical
KC,Kingsoft Cloud Holdings Limited American Depositary Shares,$2.875,0.215,8.083%,729346252.00,China,2020,1038673,Technology,Computer Software: Prepackaged Software
KD,Kyndryl Holdings Inc. Common Stock,$23.99,-0.08,-0.332%,5546667541.00,United States,2021,223914,Technology,EDP Services
KDLY,Kindly MD Inc. Common Stock,$0.908,-0.112,-10.98%,5400029.00,United States,2024,127770,Health Care,Medical/Nursing Services
KDLYW,Kindly MD Inc. Warrants,$0.1351,0.00,0.00%,803463.00,United States,2024,1,Health Care,Medical/Nursing Services
KDP,Keurig Dr Pepper Inc. Common Stock,$34.415,-0.165,-0.477%,46682352330.00,United States,,1769705,Consumer Staples,Beverages (Production/Distribution)
KE,Kimball Electronics Inc. Common Stock,$18.17,0.34,1.907%,449405115.00,United States,,22467,Technology,Electrical Products
KELYA,Kelly Services Inc. Class A Common Stock,$19.85,0.39,2.004%,706031668.00,United States,,13198,Consumer Discretionary,Professional Services
KELYB,Kelly Services Inc. Class B Common Stock,$19.3301,0.00,0.00%,687539685.00,United States,,5,Consumer Discretionary,Professional Services
KEN,Kenon Holdings Ltd. Ordinary Shares,$27.50,0.475,1.758%,1451060738.00,Singapore,2015,8873,Utilities,Electric Utilities: Central
KEP,Korea Electric Power Corporation Common Stock,$8.21,0.03,0.367%,10541050144.00,South Korea,1994,12610,Utilities,Electric Utilities: Central
KEQU,Kewaunee Scientific Corporation Common Stock,$32.56,-0.09,-0.276%,93506068.00,United States,,1881,Industrials,Medical Specialities
KEX,Kirby Corporation Common Stock,$126.75,1.25,0.996%,7338825000.00,United States,,62018,Consumer Discretionary,Marine Transportation
KEY,KeyCorp Common Stock,$17.325,0.285,1.673%,16340866074.00,United States,,2033630,Finance,Major Banks
KEY^I,KeyCorp Depositary Shares Each Representing a 1/40th Ownership Interest in a Share of Fixed-to-Floating Rate Perpetual Non-Cumulative Preferred Stock Series E,$25.1115,-0.1285,-0.509%,,United States,,2043,,
KEY^J,KeyCorp Depositary Shares each representing a 1/40th ownership interest in a share of Fixed Rate Perpetual Non-Cumulative Preferred Stock Series F,$22.79,0.04,0.176%,,United States,,2026,,
KEY^K,KeyCorp Depositary Shares each representing a 1/40th ownership interest in a share of Fixed Rate Perpetual Non-Cumulative Preferred Stock Series G,$23.1101,-0.2199,-0.943%,,United States,,5537,,
KEY^L,KeyCorp Depositary Shares each representing a 1/40th ownership interest in a share of Fixed Rate Perpetual Non-Cumulative Preferred Stock Series H,$25.00,0.03,0.12%,,United States,,11777,,
KEYS,Keysight Technologies Inc. Common Stock,$156.91,0.93,0.596%,27230687833.00,United States,2014,111926,Industrials,Industrial Machinery/Components
KF,Korea Fund Inc. (The) New Common Stock,$21.957,0.107,0.49%,0.00,United States,,2023,Finance,Investment Managers
KFFB,Kentucky First Federal Bancorp Common Stock,$3.008,-0.152,-4.81%,24324839.00,United States,2005,13181,Finance,Savings Institutions
KFRC,Kforce Inc. Common Stock,$55.50,0.95,1.742%,1075534500.00,United States,1995,24823,Consumer Discretionary,Professional Services
KFS,Kingsway Financial Services Inc. Common Stock (DE),$8.92,0.00,0.00%,248073433.00,Canada,,1089,Finance,Property-Casualty Insurers
KFY,Korn Ferry Common Stock,$70.665,1.725,2.502%,3675332158.00,United States,1999,25267,Consumer Discretionary,Diversified Commercial Services
KGC,Kinross Gold Corporation Common Stock,$10.535,0.005,0.047%,12947515000.00,Canada,2001,2576068,Basic Materials,Precious Metals
KGEI,Kolibri Global Energy Inc. Common stock,$3.48,0.00,0.00%,124361158.00,United States,,92,Energy,Oil & Gas Production
KGS,Kodiak Gas Services Inc. Common Stock,$31.505,0.145,0.462%,2662475326.00,United States,2023,80482,Utilities,Natural Gas Distribution
KHC,The Kraft Heinz Company Common Stock,$35.03,0.29,0.835%,42354033762.00,United States,,1965291,Consumer Staples,Packaged Foods
KIDS,OrthoPediatrics Corp. Common Stock,$26.32,0.63,2.452%,637323692.00,United States,2017,14569,Health Care,Medical/Dental Instruments
KIM,Kimco Realty Corporation (HC) Common Stock,$23.94,0.39,1.656%,16138245254.00,United States,,312805,Real Estate,Real Estate Investment Trusts
KIM^L,Kimco Realty Corporation Class L Depositary Shares each of which represents a one-one thousandth fractional interest in a share of 5.125% Class L Cumulative Redeemable Preferred Stock liquidation preference $25000.00 per share,$22.88,0.20,0.882%,,United States,,951,,
KIM^M,Kimco Realty Corporation Class M Depositary Shares each of which represents a one-one thousandth fractional interest in a share of 5.25% Class M Cumulative Redeemable Preferred Stock liquidation preference $25000.00 per share,$23.10,-0.10,-0.431%,,United States,,14585,,
KIM^N,Kimco Realty Corporation Depositary Shares each representing 1/1000th interest in a share of 7.25% Class N Cumulative Convertible Perpetual Preferred Stock,$60.6101,-0.3799,-0.623%,,United States,,150,,
KIND,Nextdoor Holdings Inc. Class A Common Stock,$2.42,0.12,5.217%,919378357.00,United States,,303202,Technology,Computer Software: Programming Data Processing
KINS,Kingstone Companies Inc. Common Stock,$9.83,0.05,0.511%,108766227.00,United States,,37407,Finance,Property-Casualty Insurers
KIO,KKR Income Opportunities Fund Common Shares,$13.928,0.018,0.129%,0.00,United States,2013,37057,Finance,Investment Managers
KIRK,Kirkland's Inc. COMMONSTOCK,$1.8797,0.0397,2.158%,24645946.00,United States,2002,19985,Consumer Discretionary,Other Specialty Stores
KITT,Nauticus Robotics Inc. Common stock,$1.3578,-0.0022,-0.162%,6313268.00,United States,2021,33003,Industrials,Industrial Machinery/Components
KITTW,Nauticus Robotics Inc. Warrant,$0.013,0.00,0.00%,60445.00,United States,2021,22857,Industrials,Industrial Machinery/Components
KKR,KKR & Co. Inc. Common Stock,$140.75,0.87,0.622%,124907162969.00,United States,,380644,Finance,Investment Managers
KKRS,KKR Group Finance Co. IX LLC 4.625% Subordinated Notes due 2061,$19.98,0.04,0.201%,17731048782.00,United States,2021,5731,,
KLAC,KLA Corporation Common Stock,$676.60,3.53,0.524%,90951969885.00,United States,1980,194256,Technology,Electronic Components
KLC,KinderCare Learning Companies Inc. Common Stock,$28.40,0.04,0.141%,3247996928.00,,2024,15970,Consumer Discretionary,Other Consumer Services
KLG,WK Kellogg Co Common Stock,$17.54,0.49,2.874%,1506711240.00,United States,2023,81208,Consumer Staples,Packaged Foods
KLIC,Kulicke and Soffa Industries Inc. Common Stock,$46.12,1.53,3.431%,2513967901.00,Singapore,,150492,Technology,Semiconductors
KLTO,Klotho Neurosciences Inc. Common Stock,$0.4745,-0.0055,-1.146%,8175405.00,United States,2022,31464,Health Care,Biotechnology: Biological Products (No Diagnostic Substances)
KLTOW,Klotho Neurosciences Inc. Warrant,$0.0251,-0.0102,-28.895%,432461.00,United States,2022,1463,Health Care,Biotechnology: Biological Products (No Diagnostic Substances)
KLTR,Kaltura Inc. Common Stock,$1.335,0.025,1.908%,198905578.00,United States,2021,6806,Technology,Computer Software: Prepackaged Software
KLXE,KLX Energy Services Holdings Inc. Common Stock,$4.55,0.04,0.887%,76733161.00,United States,,23799,Energy,Oilfield Services/Equipment
KMB,Kimberly-Clark Corporation Common Stock,$135.77,0.25,0.184%,45277299860.00,United States,,183464,Consumer Discretionary,Containers/Packaging
KMDA,Kamada Ltd. Ordinary Shares,$5.46,0.18,3.409%,244826400.00,Israel,2013,23749,Health Care,Biotechnology: Pharmaceutical Preparations
KMI,Kinder Morgan Inc. Common Stock,$24.86,-0.09,-0.361%,55229974005.00,United States,2011,1871760,Utilities,Natural Gas Distribution
KMPB,Kemper Corporation 5.875% Fixed-Rate Reset Junior Subordinated Debentures due 2062,$23.20,-0.09,-0.386%,1494699278.00,United States,2022,17110,Finance,Property-Casualty Insurers
KMPR,Kemper Corporation,$64.27,1.25,1.983%,4140703559.00,United States,,11921,Finance,Property-Casualty Insurers
KMT,Kennametal Inc. Common Stock,$25.55,0.54,2.159%,1990365210.00,United States,,99520,Industrials,Industrial Machinery/Components
KMX,CarMax Inc,$74.16,2.16,3.00%,11489189129.00,United States,,198444,Consumer Discretionary,Retail-Auto Dealers and Gas Stations
KN,Knowles Corporation Common Stock,$18.17,0.51,2.888%,1606723732.00,United States,2014,103802,Consumer Staples,Consumer Electronics/Appliances
KNDI,Kandi Technologies Group Inc. Ordinary Shares,$1.45,0.05,3.571%,126669439.00,China,,56595,Consumer Discretionary,Auto Manufacturing
KNF,Knife Riv Holding Co. Common Stock,$94.595,1.145,1.225%,5355278829.00,United States,2023,31524,Industrials,Mining & Quarrying of Nonmetallic Minerals (No Fuels)
KNOP,KNOT Offshore Partners LP Common Units representing Limited Partner Interests,$6.2301,-0.1199,-1.888%,212104259.00,United Kingdom,2013,11307,Consumer Discretionary,Marine Transportation
KNSA,Kiniksa Pharmaceuticals International plc Class A Ordinary Shares,$27.7957,0.3557,1.296%,1980268846.00,United States,2018,59379,Health Care,Biotechnology: Pharmaceutical Preparations
KNSL,Kinsale Capital Group Inc. Common Stock,$443.195,9.045,2.083%,10320426241.00,United States,,83921,Finance,Property-Casualty Insurers
KNTK,Kinetik Holdings Inc. Class A Common Stock,$48.7529,-0.8871,-1.787%,7679503082.00,United States,2022,197934,Utilities,Natural Gas Distribution
KNW,Know Labs Inc. Common Stock,$0.207,-0.0058,-2.726%,21937860.00,,2022,108208,Industrials,Industrial Machinery/Components
KNX,Knight-Swift Transportation Holdings Inc.,$53.53,0.98,1.865%,8664579920.00,United States,2017,351841,Industrials,Trucking Freight/Courier Services
KO,Coca-Cola Company (The) Common Stock,$66.985,0.065,0.097%,288557791289.00,United States,,2268021,Consumer Staples,Beverages (Production/Distribution)
KOD,Kodiak Sciences Inc Common Stock,$3.75,0.01,0.267%,197305234.00,United States,2018,103985,Health Care,Biotechnology: Biological Products (No Diagnostic Substances)
KODK,Eastman Kodak Company Common New,$4.78,0.10,2.137%,383834000.00,United States,,77545,Consumer Discretionary,Industrial Machinery/Components
KOF,Coca Cola Femsa S.A.B. de C.V.  American Depositary Shares each representing 10 Units (each Unit consists of 3 Series B Shares and 5 Series L Shares),$86.20,0.34,0.396%,18109174081.00,Mexico,1993,20607,Consumer Staples,Beverages (Production/Distribution)
KOP,Koppers Holdings Inc. Common Stock,$34.80,0.47,1.369%,714071501.00,United States,2006,15863,Basic Materials,Forest Products
KOPN,Kopin Corporation Common Stock,$0.80,0.0224,2.881%,96774482.00,United States,1992,276335,Technology,Semiconductors
KORE,KORE Group Holdings Inc. Common Stock,$2.00,-0.13,-6.103%,36185568.00,United States,,345,Telecommunications,Telecommunications Equipment
KOS,Kosmos Energy Ltd. Common Shares (DE),$3.995,-0.175,-4.197%,1884907601.00,Bermuda,2011,1997349,Energy,Oil & Gas Production
KOSS,Koss Corporation Common Stock,$7.595,0.335,4.614%,70631943.00,United States,,50300,Consumer Staples,Consumer Electronics/Appliances
KPLT,Katapult Holdings Inc. Common Stock,$8.97,0.36,4.181%,37395203.00,United States,2019,9214,Consumer Discretionary,Diversified Commercial Services
KPLTW,Katapult Holdings Inc. Warrant,$0.006,0.0003,5.263%,25014.00,United States,2019,1000,Consumer Discretionary,Diversified Commercial Services
KPRX,Kiora Pharmaceuticals Inc.  Common Stock,$4.00,0.36,9.89%,11882180.00,United States,,85635,Health Care,Biotechnology: Pharmaceutical Preparations
KPTI,Karyopharm Therapeutics Inc. Common Stock,$0.875,0.0479,5.791%,109098221.00,United States,2013,131733,Health Care,Biotechnology: Pharmaceutical Preparations
KR,Kroger Company (The) Common Stock,$57.25,-0.12,-0.209%,41419589416.00,United States,,309970,Consumer Staples,Food Chains
KRC,Kilroy Realty Corporation Common Stock,$41.79,0.37,0.893%,4905528803.00,United States,1997,92357,Real Estate,Real Estate Investment Trusts
KREF,KKR Real Estate Finance Trust Inc. Common Stock,$11.875,0.185,1.583%,826175231.00,United States,2017,69007,Real Estate,Real Estate Investment Trusts
KREF^A,KKR Real Estate Finance Trust Inc. 6.50% Series A Cumulative Redeemable Preferred Stock,$21.50,-0.12,-0.555%,,United States,,458,,
KRG,Kite Realty Group Trust Common Stock,$25.835,0.165,0.643%,5675061784.00,United States,2004,111929,Real Estate,Real Estate Investment Trusts
KRKR,36Kr Holdings Inc. American Depositary Shares,$4.10,-0.11,-2.613%,7996169.00,China,2019,8283,Consumer Discretionary,Business Services
KRMD,KORU Medical Systems Inc. Common Stock (DE),$2.59,0.06,2.372%,118765300.00,United States,,4282,Health Care,Medical/Dental Instruments
KRNT,Kornit Digital Ltd. Ordinary Shares,$25.15,1.45,6.118%,1200148770.00,Israel,2015,115358,Industrials,Industrial Machinery/Components
KRNY,Kearny Financial Corp Common Stock,$6.875,0.095,1.401%,443985321.00,United States,2005,50328,Finance,Savings Institutions
KRO,Kronos Worldwide Inc Common Stock,$11.735,0.085,0.73%,1349951168.00,United States,,23468,Industrials,Major Chemicals
KRON,Kronos Bio Inc. Common Stock,$0.97,0.00,0.00%,58485772.00,United States,2020,7908,Health Care,Biotechnology: Pharmaceutical Preparations
KROS,Keros Therapeutics Inc. Common Stock,$61.53,0.77,1.267%,2308734628.00,United States,2020,72780,Health Care,Biotechnology: Pharmaceutical Preparations
KRP,Kimbell Royalty Partners Common Units Representing Limited Partner Interests,$15.9517,-0.0683,-0.426%,1523287987.00,United States,2017,112676,Energy,Oil & Gas Production
KRRO,Korro Bio Inc. Common Stock,$66.22,-1.93,-2.832%,615767529.00,United States,2019,17364,Health Care,Biotechnology: Pharmaceutical Preparations
KRT,Karat Packaging Inc. Common Stock,$26.675,0.295,1.118%,533891189.00,United States,2021,1676,Industrials,Plastic Products
KRUS,Kura Sushi USA Inc. Class A Common Stock,$98.00,3.68,3.902%,1102004414.00,United States,2019,16743,Consumer Discretionary,Restaurants
KRYS,Krystal Biotech Inc. Common Stock,$179.47,3.96,2.256%,5156164127.00,United States,2017,10174,Health Care,Biotechnology: Biological Products (No Diagnostic Substances)
KSCP,Knightscope Inc. Class A Common Stock,$15.74,0.76,5.073%,48108019.00,United States,2022,93780,Telecommunications,Telecommunications Equipment
KSM,DWS Strategic Municipal Income Trust,$10.09,0.02,0.199%,0.00,United States,1989,494,Finance,Trusts Except Educational Religious and Charitable
KSPI,Joint Stock Company Kaspi.kz American Depository Shares,$111.83,3.39,3.126%,21173161391.00,Kazakhstan,2024,28845,,
KSS,Kohl's Corporation Common Stock,$19.40,0.36,1.891%,2158026027.00,United States,1992,1315657,Consumer Discretionary,Department/Specialty Retail Stores
KT,KT Corporation Common Stock,$15.705,-0.095,-0.601%,7739845585.00,South Korea,,56992,Telecommunications,Telecommunications Equipment
KTB,Kontoor Brands Inc. Common Stock ,$77.74,0.86,1.119%,4328972812.00,United States,2019,37644,Consumer Discretionary,Apparel
KTCC,Key Tronic Corporation Common Stock,$5.98,0.05,0.843%,64355989.00,United States,1983,4043,Technology,Electrical Products
KTF,DWS Municipal Income Trust,$9.8061,0.0561,0.575%,387350148.00,United States,1988,44922,Finance,Finance Companies
KTH,Structures Products Cp 8% CorTS Issued by Peco Energy Cap Tr II Preferred Stock,$30.46,0.655,2.198%,0.00,United States,,3065,Finance,Finance: Consumer Services
KTN,Structured Products Corp 8.205% CorTS 8.205% Corporate Backed Trust Securities (CorTS),$27.18,-0.11,-0.403%,0.00,United States,,2371,Finance,Finance: Consumer Services
KTOS,Kratos Defense & Security Solutions Inc. Common Stock,$23.93,-0.02,-0.084%,3613413249.00,United States,,131187,Industrials,Military/Government/Technical
KTTA,Pasithea Therapeutics Corp. Common Stock,$3.76,0.06,1.622%,3925745.00,United States,2021,29541,Health Care,Biotechnology: Pharmaceutical Preparations
KTTAW,Pasithea Therapeutics Corp. Warrant,$0.028,0.0077,37.931%,29234.00,United States,2021,1000,Health Care,Biotechnology: Pharmaceutical Preparations
KUKE,Kuke Music Holding Limited American Depositary Shares each representing one Ordinary Share,$0.6993,0.1313,23.116%,23252930.00,,2021,3424751,Real Estate,Other Consumer Services
KULR,KULR Technology Group Inc. Common Stock,$0.291,0.01,3.559%,56159979.00,United States,,985518,Technology,Electrical Products
KURA,Kura Oncology Inc. Common Stock,$18.02,0.51,2.913%,1380953618.00,United States,,37177,Health Care,Biotechnology: Pharmaceutical Preparations
KVAC,Keen Vision Acquisition Corporation Ordinary Shares,$10.80,0.03,0.279%,0.00,United States,2023,9998,,
KVACU,Keen Vision Acquisition Corporation Units,$10.80,0.19,1.791%,0.00,United States,2023,910,,
KVACW,Keen Vision Acquisition Corporation Warrant,$0.05,0.00,0.00%,0.00,United States,2023,13873,,
KVHI,KVH Industries Inc. Common Stock,$4.6501,0.0001,0.002%,91672471.00,United States,1996,1394,Technology,Radio And Television Broadcasting And Communications Equipment
KVUE,Kenvue Inc. Common Stock,$22.655,0.015,0.066%,43388116450.00,United States,2023,2114767,Consumer Discretionary,Specialty Chemicals
KVYO,Klaviyo Inc. Series A Common Stock,$39.55,0.51,1.306%,10546907104.00,United States,2023,44877,Technology,Computer Software: Prepackaged Software
KW,Kennedy-Wilson Holdings Inc. Common Stock,$11.135,0.195,1.782%,1530081763.00,United States,,64855,Finance,Real Estate
KWE,KWESST Micro Systems Inc. Common Stock,$1.63,-0.13,-7.386%,2574054.00,Canada,,128483,Technology,Computer Software: Prepackaged Software
KWESW,KWESST Micro Systems Inc. Warrant,$0.0268,0.00,0.00%,42322.00,Canada,,150,Technology,Computer Software: Prepackaged Software
KWR,Quaker Houghton Common Stock,$156.08,2.21,1.436%,2795729152.00,United States,,5931,Industrials,Major Chemicals
KXIN,Kaixin Holdings Ordinary Shares,$4.32,-1.05,-19.553%,4262047.00,China,2017,352070,Consumer Discretionary,Retail-Auto Dealers and Gas Stations
KYMR,Kymera Therapeutics Inc. Common Stock,$49.91,1.92,4.001%,3082104358.00,United States,2020,53484,Health Care,Biotechnology: Biological Products (No Diagnostic Substances)
KYN,Kayne Anderson Energy Infrastructure Fund Inc.,$11.68,-0.05,-0.426%,1590016270.00,United States,2004,36279,Finance,Finance/Investors Services
KYTX,Kyverna Therapeutics Inc. Common Stock,$5.28,0.16,3.125%,227815379.00,United States,2024,37263,Health Care,Biotechnology: Biological Products (No Diagnostic Substances)
KZIA,Kazia Therapeutics Limited American Depositary Shares,$4.96,-0.24,-4.615%,147758400.00,Australia,,71774,Health Care,Biotechnology: Pharmaceutical Preparations
KZR,Kezar Life Sciences Inc. Common Stock,$0.7817,-0.004,-0.509%,57034567.00,United States,2018,467781,Health Care,Biotechnology: Pharmaceutical Preparations
L,Loews Corporation Common Stock,$80.555,0.985,1.238%,17683152624.00,United States,,63981,Finance,Property-Casualty Insurers
LAAC,Lithium Americas (Argentina) Corp. Common Shares,$3.70,0.20,5.714%,596810000.00,Canada,2023,747750,,
LAB,Standard BioTools Inc. Common Stock,$1.735,0.055,3.274%,643953007.00,United States,2011,602303,Industrials,Biotechnology: Laboratory Analytical Instruments
LAC,Lithium Americas Corp. Common Shares,$4.235,0.555,15.082%,683105500.00,Canada,2023,10427007,Basic Materials,Metal Mining
LAD,Lithia Motors Inc. Common Stock,$337.89,4.79,1.438%,9035136364.00,United States,,30937,Consumer Discretionary,Retail-Auto Dealers and Gas Stations
LADR,Ladder Capital Corp Class A Common Stock,$11.305,0.025,0.222%,1445526340.00,United States,2014,113696,Real Estate,Real Estate Investment Trusts
LAES,SEALSQ Corp Ordinary Shares,$0.3933,-0.0058,-1.453%,9195354.00,Switzerland,,201806,Technology,Semiconductors
LAKE,Lakeland Industries Inc. Common Stock,$20.47,0.22,1.086%,151408484.00,United States,1986,3417,Health Care,Industrial Specialties
LAMR,Lamar Advertising Company Class A Common Stock,$136.22,1.53,1.136%,13935528447.00,United States,1996,17790,Real Estate,Real Estate Investment Trusts
LANC,Lancaster Colony Corporation Common Stock,$181.11,3.90,2.201%,4985414970.00,United States,,14516,Consumer Staples,Packaged Foods
LAND,Gladstone Land Corporation Common Stock,$13.32,0.12,0.909%,477368047.00,United States,1993,41384,Real Estate,Real Estate Investment Trusts
LANDM,Gladstone Land Corporation 5.00% Series D Cumulative Term Preferred Stock,$24.5977,0.0563,0.229%,881543245.00,United States,,746,Real Estate,Real Estate Investment Trusts
LANDO,Gladstone Land Corporation 6.00% Series B Cumulative Redeemable Preferred Stock,$21.83,-0.0299,-0.137%,782353189.00,United States,,2530,Real Estate,Real Estate Investment Trusts
LANDP,Gladstone Land Corporation 6.00% Series C Cumulative Redeemable Preferred Stock,$21.12,0.28,1.344%,756907895.00,United States,,5922,Real Estate,Real Estate Investment Trusts
LANV,Lanvin Group Holdings Limited Ordinary Shares,$1.8218,-0.0282,-1.524%,238603095.00,Cayman Islands,1996,740,Finance,Blank Checks
LARK,Landmark Bancorp Inc. Common Stock,$20.245,0.00,0.00%,111396250.00,United States,,37,Finance,Major Banks
LASE,Laser Photonics Corporation Common Stock,$5.40,-0.46,-7.85%,66260306.00,United States,2022,410113,Miscellaneous,Industrial Machinery/Components
LASR,nLIGHT Inc. Common Stock,$12.54,2.21,21.394%,603495789.00,United States,2018,263028,Technology,Semiconductors
LATG,Chenghe Acquisition I Co. Class A Ordinary Shares,$11.66,0.00,0.00%,189475000.00,Mexico,2022,1,Finance,Blank Checks
LAUR,Laureate Education Inc. Common Stock,$15.46,0.16,1.046%,2358357573.00,United States,2017,26736,Real Estate,Other Consumer Services
LAW,CS Disco Inc. Common Stock,$5.935,0.115,1.976%,353016400.00,United States,2021,3266,Technology,Computer Software: Prepackaged Software
LAZ,Lazard Inc. Common Stock,$51.58,0.46,0.90%,4650968600.00,Bermuda,2005,185351,Finance,Investment Managers
LAZR,Luminar Technologies Inc.  Class A Common Stock,$0.9355,0.1206,14.799%,461912982.00,United States,2019,24745421,Consumer Discretionary,Auto Parts:O.E.M.
LB,LandBridge Company LLC Class A Shares Representing Limited Liability Company Interests,$52.39,0.16,0.306%,3832412481.00,,2024,57100,Energy,Oil & Gas Production
LBGJ,Li Bang International Corporation Inc. Ordinary Shares,$4.20,0.39,10.236%,77784000.00,China,2024,46548,,
LBPH,Longboard Pharmaceuticals Inc. Common Stock,$59.68,0.08,0.134%,2321523413.00,United States,2021,272699,Health Care,Biotechnology: Pharmaceutical Preparations
LBRDA,Liberty Broadband Corporation Class A Common Stock,$82.245,0.825,1.013%,11748531210.00,United States,,10288,Telecommunications,Cable & Other Pay Television Services
LBRDK,Liberty Broadband Corporation Class C Common Stock,$82.85,0.96,1.172%,11834954232.00,United States,,43989,Telecommunications,Cable & Other Pay Television Services
LBRDP,Liberty Broadband Corporation Series A Cumulative Redeemable Preferred Stock,$23.85,0.00,0.00%,3406924061.00,United States,,1761,Telecommunications,Cable & Other Pay Television Services
LBRT,Liberty Energy Inc. Class A common stock,$17.515,-0.395,-2.205%,2862225723.00,United States,2018,359787,Energy,Oilfield Services/Equipment
LBTYA,Liberty Global Ltd. Class A Common Shares,$20.985,0.185,0.889%,7668860408.00,United Kingdom,,330748,Telecommunications,Cable & Other Pay Television Services
LBTYB,Liberty Global Ltd. Class B Common Shares,$20.60,0.00,0.00%,7528164137.00,United Kingdom,,19,Telecommunications,Cable & Other Pay Television Services
LBTYK,Liberty Global Ltd. Class C Common Shares,$21.65,0.22,1.027%,7911881241.00,United Kingdom,,180203,Telecommunications,Cable & Other Pay Television Services
