Symbol,Name,Last Sale,Net Change,% Change,Market Cap,Country,IPO Year,Volume,Sector,Industry
PSA^M,Public Storage Depositary Shares Each Representing 1/1000 of a 4.125% Cumulative Preferred Share of Beneficial Interest Series M,$19.91,0.03,0.151%,,United States,,581,,
PSA^N,Public Storage Depositary Shares Each Representing 1/1000 of a 3.875% Cumulative Preferred Share of Beneficial Interest Series N,$18.51,0.20,1.092%,,United States,,291,,
PSA^O,Public Storage Depositary Shares Each Representing 1/1000 of a 3.900% Cumulative Preferred Share of Beneficial Interest Series O,$18.40,0.00,0.00%,,United States,,9,,
PSA^P,Public Storage Depositary Shares Each Representing 1/1000 of a 4.000% Cumulative Preferred Share of Bene cial Interest Series P,$19.01,0.11,0.582%,,United States,,2023,,
PSA^Q,Public Storage Depositary Shares Each Representing 1/1000 of a 3.950% Cumulative Preferred Share of Beneficial Interest Series Q par value $0.01 per share,$18.8227,0.0427,0.227%,,United States,,1180,,
PSA^R,Public Storage Depositary Shares Each Representing 1/1000 of a 4.00% Cumulative Preferred Share of Bene cial Interest Series R,$19.42,0.14,0.726%,,United States,,3438,,
PSA^S,Public Storage Depositary Shares Each Representing 1/1000 of a 4.100% Cumulative Preferred Share of Beneficial Interest Series S,$19.85,0.15,0.761%,,United States,,924,,
PSBD,Palmer Square Capital BDC Inc. Common Stock,$16.24,-0.01,-0.062%,0.00,,2024,1971,,
PSEC,Prospect Capital Corporation Common Stock,$5.325,0.015,0.282%,2284362256.00,United States,2004,746197,Finance,Finance: Consumer Services
PSEC^A,Prospect Capital Corporation 5.35% Series A Fixed Rate Cumulative Perpetual Preferred Stock,$19.40,-0.04,-0.206%,,United States,,167,,
PSF,Cohen & Steers Select Preferred and Income Fund Inc. Common Stock,$20.7105,0.0605,0.293%,1017685555.00,,2010,8851,Finance,Investment Managers
PSFE,Paysafe Limited Common Shares,$22.18,0.27,1.232%,1368937246.00,,2021,47796,Consumer Discretionary,Business Services
PSHG,Performance Shipping Inc. Common Shares,$2.10,0.03,1.449%,25787320.00,Greece,,18333,Consumer Discretionary,Marine Transportation
PSIG,PS International Group Ltd. Ordinary Shares,$0.8023,0.0032,0.40%,19482200.00,Hong Kong,,13123,Consumer Discretionary,Oil Refining/Marketing
PSMT,PriceSmart Inc. Common Stock,$92.21,0.51,0.556%,2825221545.00,United States,,20475,Consumer Discretionary,Department/Specialty Retail Stores
PSN,Parsons Corporation Common Stock,$104.46,0.25,0.24%,11092098889.00,United States,2019,125697,Technology,EDP Services
PSNL,Personalis Inc. Common Stock,$5.1623,0.4523,9.603%,340298816.00,United States,2019,227622,Health Care,Medical Specialities
PSNY,Polestar Automotive Holding UK PLC Class A ADS,$1.365,0.035,2.632%,2914562043.00,Sweden,,1152424,Consumer Discretionary,Auto Manufacturing
PSNYW,Polestar Automotive Holding UK PLC Class C-1 ADS (ADW),$0.2327,0.0102,4.584%,496863434.00,Sweden,,16892,Consumer Discretionary,Auto Manufacturing
PSO,Pearson Plc Common Stock,$13.835,0.315,2.33%,9216902788.00,United Kingdom,,90990,Consumer Discretionary,Books
PSQH,PSQ Holdings Inc. Class A Common Stock,$2.82,0.15,5.618%,88524298.00,,2021,89880,Consumer Discretionary,Advertising
PSTG,Pure Storage Inc. Class A Common Stock,$54.54,0.49,0.907%,17872315899.00,United States,2015,169885,Technology,Electronic Components
PSTL,Postal Realty Trust Inc. Class A Common Stock,$14.5379,0.2279,1.593%,334856190.00,United States,2019,13914,Real Estate,Real Estate Investment Trusts
PSTV,PLUS THERAPEUTICS Inc. Common Stock ,$1.33,-0.02,-1.481%,7842123.00,United States,,5066,Health Care,Medical/Dental Instruments
PSTX,Poseida Therapeutics Inc. Common Stock,$2.495,0.085,3.527%,242314837.00,United States,2020,70524,Health Care,Biotechnology: Biological Products (No Diagnostic Substances)
PSX,Phillips 66 Common Stock,$128.429,0.259,0.202%,53756421604.00,United States,,390328,Energy,Integrated oil Companies
PT,Pintec Technology Holdings Limited American Depositary Shares,$0.9501,-0.0499,-4.99%,15152158.00,China,2018,1821,Technology,Computer Software: Programming Data Processing
PTA,Cohen & Steers Tax-Advantaged Preferred Securities and Income Fund Common Shares of Beneficial Interest,$20.56,-0.02,-0.097%,1136422276.00,United States,2020,4463,Finance,Trusts Except Educational Religious and Charitable
PTC,PTC Inc. Common Stock,$187.465,0.455,0.243%,22521151079.00,United States,,98024,Technology,Computer Software: Prepackaged Software
PTCT,PTC Therapeutics Inc. Common Stock,$41.495,0.745,1.828%,3191968434.00,United States,2013,94067,Health Care,Biotechnology: Pharmaceutical Preparations
PTEN,Patterson-UTI Energy Inc. Common Stock,$7.935,-0.235,-2.876%,3118850203.00,United States,1993,1516512,Energy,Oil & Gas Production
PTGX,Protagonist Therapeutics Inc. Common Stock,$48.53,1.27,2.687%,2858639510.00,United States,2016,60965,Health Care,Biotechnology: Pharmaceutical Preparations
PTHL,Pheton Holdings Ltd Class A Ordinary Shares,$4.53,-0.02,-0.44%,65685000.00,China,2024,30804,Health Care,Biotechnology: Electromedical & Electrotherapeutic Apparatus
PTIX,Protagenic Therapeutics Inc. Common Stock,$0.6506,0.0376,6.134%,2906403.00,United States,,6864,Health Care,Biotechnology: Pharmaceutical Preparations
PTIXW,Protagenic Therapeutics Inc. Warrant,$0.009,0.00,0.00%,40205.00,United States,,13572,Health Care,Biotechnology: Pharmaceutical Preparations
PTLE,PTL LTD Ordinary Shares,$4.10,-0.01,-0.243%,51250000.00,Singapore,2024,8686,Energy,Oil Refining/Marketing
PTLO,Portillo's Inc. Class A Common Stock,$13.32,0.43,3.336%,823104365.00,United States,2021,290244,Consumer Discretionary,Restaurants
PTMN,Portman Ridge Finance Corporation Common Stock,$18.44,0.09,0.49%,170459803.00,United States,2006,4056,Finance,Finance: Consumer Services
PTN,Palatin Technologies Inc. Common Stock,$1.115,0.025,2.294%,21796206.00,United States,1999,65846,Health Care,Biotechnology: Pharmaceutical Preparations
PTON,Peloton Interactive Inc. Class A Common Stock,$6.44,0.16,2.548%,2424141000.00,United States,2019,5511149,Consumer Discretionary,Recreational Games/Products/Toys
PTPI,Petros Pharmaceuticals Inc. Common Stock,$0.381,-0.0267,-6.549%,3660144.00,United States,,104896,Health Care,Biotechnology: Pharmaceutical Preparations
PTSI,P.A.M. Transportation Services Inc. Common Stock,$16.47,0.32,1.981%,358305031.00,United States,1986,1729,Industrials,Trucking Freight/Courier Services
PTVE,Pactiv Evergreen Inc. Common stock,$11.86,0.32,2.773%,2125959995.00,United States,2020,25519,Consumer Discretionary,Containers/Packaging
PTY,Pimco Corporate & Income Opportunity Fund,$14.52,0.00,0.00%,0.00,United States,2002,171557,Finance,Investment Managers
PUBM,PubMatic Inc. Class A Common Stock,$15.18,0.39,2.637%,752686805.00,United States,2020,34288,Technology,Computer Software: Programming Data Processing
PUK,Prudential Public Limited Company Common Stock,$16.86,0.21,1.261%,22800431258.00,United Kingdom,,439882,Finance,Life Insurance
PULM,Pulmatrix Inc. Common Stock,$2.03,0.0101,0.50%,7414139.00,United States,2014,5800,Health Care,Biotechnology: Pharmaceutical Preparations
PUMP,ProPetro Holding Corp. Common Stock,$7.635,-0.115,-1.484%,795278221.00,United States,2017,144626,Energy,Oilfield Services/Equipment
PVBC,Provident Bancorp Inc. (MD) Common Stock,$10.405,0.045,0.434%,183828537.00,United States,2015,3309,Finance,Banks
PVH,PVH Corp. Common Stock,$96.53,3.27,3.506%,5387734880.00,United States,,58056,Consumer Discretionary,Apparel
PVL,Permianville Royalty Trust Trust Units ,$1.5973,0.0073,0.459%,52710900.00,United States,2011,39420,Energy,Oil & Gas Production
PW,Power REIT (MD) Common Stock,$1.15,0.04,3.604%,3898110.00,United States,1998,10297,Real Estate,Real Estate Investment Trusts
PW^A,Power REIT 7.75% Series A Cumulative Perpetual Preferred Stock,$3.46,-0.04,-1.143%,,United States,,101,,
PWM,Prestige Wealth Inc. Class A Ordinary Shares,$0.8697,0.0597,7.37%,7957755.00,Hong Kong,2023,147015,Finance,Finance: Consumer Services
PWOD,Penns Woods Bancorp Inc. Common Stock,$25.65,0.05,0.195%,193517220.00,United States,,1859,Finance,Major Banks
PWP,Perella Weinberg Partners Class A Common Stock,$20.82,0.40,1.959%,1787172519.00,United States,2020,75340,Finance,Finance: Consumer Services
PWR,Quanta Services Inc. Common Stock,$310.73,2.56,0.831%,45779782229.00,United States,,118181,Industrials,Engineering & Construction
PWUP,PowerUp Acquisition Corp. Class A Ordinary Shares,$11.69,0.00,0.00%,0.00,United States,2022,1,Finance,Blank Checks
PWUPU,PowerUp Acquisition Corp. Unit,$11.45,0.00,0.00%,0.00,United States,2022,46,Finance,Blank Checks
PWUPW,PowerUp Acquisition Corp. Warrant,$0.032,0.0029,9.966%,0.00,United States,2022,13600,Finance,Blank Checks
PX,P10 Inc. Class A Common Stock,$11.37,0.25,2.248%,1269789070.00,United States,2021,22749,Finance,Investment Managers
PXDT,Pixie Dust Technologies Inc. American Depositary Shares ,$0.8341,0.1641,24.493%,12402289.00,Japan,2023,3707888,Health Care,Biotechnology: Electromedical & Electrotherapeutic Apparatus
PXLW,Pixelworks Inc.  Common Stock,$0.7878,0.0418,5.603%,46127017.00,United States,2000,47567,Technology,Semiconductors
PXS,Pyxis Tankers Inc. Common Stock,$4.73,0.06,1.285%,49866247.00,Greece,,8278,Consumer Discretionary,Marine Transportation
PXSAW,Pyxis Tankers Inc. Warrant,$0.7499,0.00,0.00%,7905856.00,Greece,,2,Consumer Discretionary,Marine Transportation
PYCR,Paycor HCM Inc. Common Stock,$14.71,0.36,2.509%,2630473312.00,United States,2021,55080,Technology,Computer Software: Prepackaged Software
PYN,PIMCO New York Municipal Income Fund III Common Shares of Beneficial Interest,$6.05,0.01,0.166%,0.00,United States,2002,2588,Finance,Investment Managers
PYPD,PolyPid Ltd. Ordinary Shares,$3.25,-0.07,-2.108%,22111304.00,Israel,2020,3692,Health Care,Biotechnology: Pharmaceutical Preparations
PYPL,PayPal Holdings Inc. Common Stock,$83.495,1.795,2.197%,85359726649.00,United States,,3880728,Consumer Discretionary,Business Services
PYT,PPlus Tr GSC-2 Tr Ctf Fltg Rate,$23.00,0.00,0.00%,0.00,United States,,106,Finance,Finance: Consumer Services
PYXS,Pyxis Oncology Inc. Common Stock,$3.84,0.18,4.918%,226338213.00,United States,2021,104984,Health Care,Biotechnology: Pharmaceutical Preparations
PZC,PIMCO California Municipal Income Fund III Common Shares of Beneficial Interest,$7.40,0.05,0.68%,0.00,United States,2002,6472,Finance,Investment Managers
PZG,Paramount Gold Nevada Corp. Common Stock,$0.417,0.0038,0.92%,27171396.00,United States,2015,5044,Basic Materials,Metal Mining
PZZA,Papa John's International Inc. Common Stock,$53.90,2.88,5.645%,1758535255.00,United States,1993,189197,Consumer Discretionary,Restaurants
QBTS,D-Wave Quantum Inc. Common Shares,$1.136,0.096,9.231%,228823681.00,,2022,3456600,Technology,EDP Services
QCOM,QUALCOMM Incorporated Common Stock,$172.44,2.17,1.274%,192098160000.00,United States,1991,1233031,Technology,Radio And Television Broadcasting And Communications Equipment
QCRH,QCR Holdings Inc. Common Stock,$80.5825,1.9225,2.444%,1357164260.00,United States,,9919,Finance,Major Banks
QD,Qudian Inc. American Depositary Shares each representing one Class A Ordinary Share,$2.485,0.135,5.745%,470668570.00,China,2017,379358,Finance,Finance: Consumer Services
QDEL,QuidelOrtho Corporation Common Stock,$39.25,0.57,1.474%,2638989215.00,United States,,85351,Health Care,Biotechnology: In Vitro & In Vivo Diagnostic Substances
QETA,Quetta Acquisition Corporation Common Stock,$10.4472,-0.0174,-0.166%,0.00,United States,2023,3738,Finance,Blank Checks
QETAU,Quetta Acquisition Corporation Unit,$10.54,0.03,0.285%,0.00,United States,2023,231,Finance,Blank Checks
QFIN,Qifu Technology Inc. American Depositary Shares,$34.735,-0.085,-0.244%,5392764189.00,China,2018,237839,Finance,Finance: Consumer Services
QGEN,Qiagen N.V. Common Shares,$42.03,0.48,1.155%,9591361793.00,Netherlands,,85199,Health Care,Biotechnology: Biological Products (No Diagnostic Substances)
QH,Quhuo Limited American Depository Shares,$1.42,0.03,2.158%,8758022.00,China,2020,23296,Consumer Discretionary,Business Services
QIPT,Quipt Home Medical Corp. Common Shares,$2.77,0.06,2.214%,119359300.00,United States,,39833,Health Care,Misc Health and Biotechnology Services
QLGN,Qualigen Therapeutics Inc. Common Stock,$0.1173,-0.0042,-3.457%,1425879.00,United States,2015,6420248,Health Care,Biotechnology: Pharmaceutical Preparations
QLYS,Qualys Inc. Common Stock,$122.00,0.88,0.727%,4490944196.00,United States,2012,20631,Technology,Computer Software: Prepackaged Software
QMCO,Quantum Corporation Common Stock,$5.27,0.31,6.25%,25257476.00,United States,,32734,Technology,Electronic Components
QMMM,QMMM Holdings Limited Ordinary Shares,$9.49,0.13,1.389%,162516250.00,Hong Kong,2024,34419,Consumer Discretionary,Advertising
QNCX,Quince Therapeutics Inc. Common Stock,$1.0605,-0.0195,-1.806%,45894841.00,United States,2019,94426,Health Care,Biotechnology: Biological Products (No Diagnostic Substances)
QNRX,Quoin Pharmaceuticals Ltd. American Depositary Shares,$0.8812,0.0732,9.059%,3507150.00,Israel,2016,527562,Health Care,Medical/Dental Instruments
QNST,QuinStreet Inc. Common Stock,$18.81,0.24,1.292%,1052910328.00,United States,2010,27367,Consumer Discretionary,Business Services
QNTM,Quantum Biopharma Ltd. Class B Subordinate Voting Shares,$5.5398,-0.1242,-2.193%,7204399.00,Canada,,37713,Health Care,Biotechnology: Pharmaceutical Preparations
QOMOW,Qomolangma Acquisition Corp. Warrant,$0.026,-0.0001,-0.383%,0.00,United States,2022,1204,Finance,Blank Checks
QQQX,Nuveen NASDAQ 100 Dynamic Overwrite Fund Shares of Beneficial Interest,$25.554,0.104,0.409%,0.00,United States,,14582,Finance,Finance Companies
QRHC,Quest Resource Holding Corporation Common Stock,$7.985,-0.055,-0.684%,162761872.00,United States,,10745,Utilities,Environmental Services
QRTEA,Qurate Retail Inc. Series A Common Stock ,$0.5553,0.0127,2.341%,220410534.00,United States,,592399,Consumer Discretionary,Catalog/Specialty Distribution
QRTEB,Qurate Retail Inc. Series B Common Stock ,$3.47,0.07,2.059%,1377317765.00,United States,,1383,Consumer Discretionary,Catalog/Specialty Distribution
QRTEP,Qurate Retail Inc. 8.0% Fixed Rate Cumulative Redeemable Preferred Stock,$39.00,0.05,0.128%,15479940294.00,United States,,14065,Consumer Discretionary,Catalog/Specialty Distribution
QRVO,Qorvo Inc. Common Stock,$100.80,1.79,1.808%,9562023677.00,United States,,155653,Technology,Semiconductors
QS,QuantumScape Corporation Class A Common Stock,$5.835,-0.355,-5.735%,2953172698.00,United States,2020,7721542,Miscellaneous,Industrial Machinery/Components
QSG,QuantaSing Group Limited American Depositary Shares,$2.89,0.21,7.836%,147716579.00,China,2023,47177,Real Estate,Other Consumer Services
QSI,Quantum-Si Incorporated Class A Common Stock,$0.7699,0.0249,3.342%,109603966.00,United States,2020,325996,Industrials,Industrial Machinery/Components
QSIAW,Quantum-Si Incorporated Warrant,$0.0686,-0.0001,-0.146%,9765985.00,United States,2020,1202,Industrials,Industrial Machinery/Components
QSR,Restaurant Brands International Inc. Common Shares,$70.835,0.295,0.418%,31918371632.00,Canada,2014,280775,Consumer Discretionary,Restaurants
QTI,QT Imaging Holdings Inc. Common Stock,$0.7072,-0.0018,-0.254%,15163369.00,United States,,2517,Health Care,Biotechnology: Electromedical & Electrotherapeutic Apparatus
QTRX,Quanterix Corporation Common Stock,$12.46,-0.01,-0.08%,478202751.00,United States,2017,61787,Industrials,Biotechnology: Laboratory Analytical Instruments
QTTB,Q32 Bio Inc. Common Stock,$50.50,-0.09,-0.178%,609019193.00,United States,2018,15298,Health Care,Biotechnology: Pharmaceutical Preparations
QTWO,Q2 Holdings Inc. Common Stock,$84.14,0.78,0.936%,5072226092.00,United States,2014,67822,Technology,Computer Software: Prepackaged Software
QUAD,Quad Graphics Inc Class A Common Stock,$5.27,0.16,3.131%,274888786.00,United States,,22735,Consumer Discretionary,Publishing
QUBT,Quantum Computing Inc. Common Stock,$1.175,0.085,7.798%,107330540.00,United States,,2329714,Technology,Computer Software: Prepackaged Software
QUIK,QuickLogic Corporation Common Stock,$8.90,0.33,3.851%,128743920.00,United States,1999,27873,Technology,Semiconductors
QURE,uniQure N.V. Ordinary Shares,$6.95,0.415,6.35%,338448452.00,Netherlands,2014,224569,Health Care,Biotechnology: Pharmaceutical Preparations
QVCC,QVC Inc. 6.250% Senior Secured Notes due 2068,$13.72,0.05,0.366%,14.00,United States,2019,2181,Consumer Discretionary,Catalog/Specialty Distribution
QVCD,QVC Inc. 6.375% Senior Secured Notes due 2067,$13.8599,-0.0101,-0.073%,14.00,United States,2018,2658,Consumer Discretionary,Catalog/Specialty Distribution
QXO,QXO Inc. Common Stock,$15.10,0.01,0.066%,6182395945.00,United States,,177696,Technology,EDP Services
R,Ryder System Inc. Common Stock,$143.52,3.76,2.69%,6069491370.00,United States,,36593,Consumer Discretionary,Rental/Leasing Companies
RA,Brookfield Real Assets Income Fund Inc. Common Stock,$13.415,0.035,0.262%,0.00,United States,2016,51526,Finance,Investment Managers
RACE,Ferrari N.V. Common Shares,$490.69,5.96,1.23%,119606159544.00,Italy,2015,41079,Consumer Discretionary,Auto Manufacturing
RAIL,FreightCar America Inc. Common Stock,$14.29,-0.28,-1.922%,269707317.00,United States,2005,212725,Industrials,Railroads
RAMP,LiveRamp Holdings Inc. Common Stock,$25.06,0.32,1.293%,1669287849.00,United States,2018,51563,Technology,EDP Services
RAND,Rand Capital Corporation Common Stock,$16.4101,0.00,0.00%,42354813.00,United States,,26,Finance,Finance: Consumer Services
RANI,Rani Therapeutics Holdings Inc. Class A Common Stock,$2.487,0.147,6.282%,132821985.00,United States,2021,569129,Health Care,Biotechnology: Pharmaceutical Preparations
RAPP,Rapport Therapeutics Inc. Common Stock,$25.12,0.90,3.716%,918800600.00,United States,2024,4905,Health Care,Biotechnology: Pharmaceutical Preparations
RAPT,RAPT Therapeutics Inc. Common Stock,$1.9607,0.0707,3.741%,68435245.00,United States,2019,39495,Health Care,Biotechnology: Pharmaceutical Preparations
RARE,Ultragenyx Pharmaceutical Inc. Common Stock,$54.44,0.62,1.152%,5017472944.00,United States,2014,138038,Health Care,Biotechnology: Pharmaceutical Preparations
RAVE,Rave Restaurant Group Inc. Common Stock,$2.84,0.07,2.527%,41425847.00,United States,,3511,Consumer Discretionary,Food Distributors
RAY,Raytech Holding Limited Ordinary Shares,$1.48,0.08,5.714%,26067363.00,Hong Kong,2024,11076,Consumer Discretionary,Consumer Electronics/Appliances
RAYA,Erayak Power Solution Group Inc. Class A Ordinary Shares,$1.29,-0.075,-5.495%,16060500.00,China,2022,29901,Consumer Discretionary,Metal Fabrications
RBA,RB Global Inc. Common Stock,$86.21,1.27,1.495%,15884537771.00,Canada,,208716,Consumer Discretionary,Business Services
RBB,RBB Bancorp Common Stock,$22.42,0.29,1.31%,399183347.00,United States,2017,704,Finance,Major Banks
RBBN,Ribbon Communications Inc. Common Stock,$3.74,0.04,1.081%,655934989.00,United States,,120779,Technology,EDP Services
RBC,RBC Bearings Incorporated Common Stock,$290.875,2.035,0.705%,8502236400.00,United States,2022,14755,Industrials,Metal Fabrications
RBCAA,Republic Bancorp Inc. Class A Common Stock,$68.7015,1.6715,2.494%,1335150104.00,United States,1998,1916,Finance,Major Banks
RBKB,Rhinebeck Bancorp Inc. Common Stock,$8.81,0.00,0.00%,97681818.00,United States,2019,21,Finance,Banks
RBLX,Roblox Corporation Class A Common Stock,$42.88,0.74,1.756%,27751936000.00,United States,2021,1327518,Technology,Computer Software: Prepackaged Software
RBOT,Vicarious Surgical Inc. Class A Common Stock,$8.2668,0.3262,4.108%,48751824.00,Hong Kong,2020,2774,Health Care,Industrial Specialties
RBRK,Rubrik Inc. Class A Common Stock,$40.18,0.78,1.98%,7298826018.00,United States,2024,154574,Technology,Computer Software: Prepackaged Software
RC,Ready Capital Corporation Common Stock,$6.96,0.09,1.31%,1170775279.00,United States,2013,243778,Real Estate,Real Estate Investment Trusts
RC^C,Ready Capital Corporation 6.25% Series C Cumulative Convertible Preferred Stock,$19.00,0.00,0.00%,,United States,,10,,
RC^E,Ready Capital Corporation 6.50% Series E Cumulative Redeemable Preferred Stock,$19.25,-0.025,-0.13%,,United States,,1301,,
RCAT,Red Cat Holdings Inc. Common Stock,$2.83,0.14,5.204%,213407578.00,United States,,441432,Technology,Computer Software: Prepackaged Software
RCB,Ready Capital Corporation 6.20% Senior Notes due 2026,$24.4231,-0.0223,-0.091%,4108327834.00,United States,2019,696,Real Estate,Real Estate Investment Trusts
RCC,Ready Capital Corporation 5.75% Senior Notes due 2026,$24.36,0.00,0.00%,4097713478.00,United States,2021,51,Real Estate,Real Estate Investment Trusts
RCEL,Avita Medical Inc. Common Stock,$10.5102,0.3802,3.753%,273156934.00,United States,,27137,Health Care,Medical/Dental Instruments
RCFA,Perception Capital Corp. IV Class A Ordinary Shares,$11.506,0.006,0.052%,0.00,,2021,1800,Finance,Blank Checks
RCG,RENN Fund Inc Common Stock,$2.165,0.005,0.231%,0.00,United States,,3034,Finance,Investment Managers
RCI,Rogers Communication Inc. Common Stock,$37.51,0.37,0.996%,19927733983.00,Canada,,124040,Telecommunications,Cable & Other Pay Television Services
RCKT,Rocket Pharmaceuticals Inc. Common Stock,$17.525,0.485,2.846%,1594351929.00,United States,2015,108859,Health Care,Biotechnology: Pharmaceutical Preparations
RCKTW,Rocket Pharmaceuticals Inc. Warrant,$0.0665,0.00,0.00%,6049895.00,United States,,2,Health Care,Biotechnology: Pharmaceutical Preparations
RCKY,Rocky Brands Inc. Common Stock,$28.38,0.98,3.577%,211403188.00,United States,1993,3100,Consumer Discretionary,Shoe Manufacturing
RCL,Royal Caribbean Cruises Ltd. Common Stock,$202.57,1.66,0.826%,52145638476.00,United States,1993,750076,Consumer Discretionary,Marine Transportation
RCM,R1 RCM Inc. Common Stock,$14.25,0.00,0.00%,6015052723.00,United States,,137107,Consumer Discretionary,Other Consumer Services
RCMT,RCM Technologies Inc. Common Stock,$21.2286,0.2586,1.233%,161952310.00,United States,,1943,Consumer Discretionary,Professional Services
RCON,Recon Technology Ltd. Class A Ordinary Shares,$3.15,-0.32,-9.222%,47180561.00,China,2009,15758,Energy,Oilfield Services/Equipment
RCS,PIMCO Strategic Income Fund Inc.,$7.5375,0.0375,0.50%,0.00,United States,1994,30954,Finance,Investment Managers
RCUS,Arcus Biosciences Inc. Common Stock,$16.67,0.35,2.145%,1524096508.00,United States,2018,120444,Health Care,Biotechnology: Pharmaceutical Preparations
RDACU,Rising Dragon Acquisition Corp. Unit,$10.01,0.00,0.00%,0.00,China,2024,52635,Finance,Blank Checks
RDCM,Radcom Ltd. Ordinary Shares,$10.31,0.21,2.079%,157822717.00,Israel,1997,8513,Technology,Computer peripheral equipment
RDDT,Reddit Inc. Class A Common Stock,$81.45,0.09,0.111%,13510604598.00,United States,2024,2042995,Technology,EDP Services
RDFN,Redfin Corporation Common Stock,$10.39,0.40,4.004%,1265234561.00,United States,2017,1144653,Finance,Real Estate
RDHL,Redhill Biopharma Ltd. American Depositary Shares,$8.20,0.00,0.00%,10500420.00,Israel,,11592,Health Care,Biotechnology: Pharmaceutical Preparations
RDI,Reading International Inc Class A Common Stock,$1.4101,-0.0399,-2.752%,31623162.00,United States,,226,Consumer Discretionary,Movies/Entertainment
RDIB,Reading International Inc Class B Common Stock,$7.70,0.78,11.272%,172681617.00,United States,,4743,Consumer Discretionary,Movies/Entertainment
RDN,Radian Group Inc. Common Stock,$34.07,0.51,1.52%,5124770390.00,United States,,31668,Finance,Property-Casualty Insurers
RDNT,RadNet Inc. Common Stock,$67.92,1.55,2.335%,5023177099.00,United States,,45802,Health Care,Medical Specialities
RDUS,Radius Recycling Inc. Class A Common Stock,$16.34,0.40,2.509%,458164678.00,United States,,29212,Consumer Discretionary,Industrial Specialties
RDVT,Red Violet Inc. Common Stock ,$28.825,0.255,0.893%,395810949.00,United States,,3879,Technology,Computer Software: Prepackaged Software
RDW,Redwire Corporation Common Stock,$9.1378,0.5478,6.377%,607988430.00,United States,2021,237935,Industrials,Military/Government/Technical
RDWR,Radware Ltd. Ordinary Shares,$23.07,0.69,3.083%,961993069.00,Israel,1999,14103,Consumer Discretionary,Business Services
RDY,Dr. Reddy's Laboratories Ltd Common Stock,$77.69,1.31,1.715%,12960111086.00,India,,15640,Health Care,Biotechnology: Pharmaceutical Preparations
RDZN,Roadzen Inc. Ordinary Shares,$0.9871,0.0987,11.11%,67557942.00,United States,2022,26533,Finance,Specialty Insurers
REAL,The RealReal Inc. Common Stock,$2.87,-0.06,-2.048%,311389848.00,United States,2019,2065573,Consumer Discretionary,Other Specialty Stores
REAX,The Real Brokerage Inc. Common Shares,$5.395,0.265,5.166%,1054183000.00,Canada,,144697,Finance,Real Estate
REBN,Reborn Coffee Inc. Common Stock,$1.89,-0.01,-0.526%,7092244.00,United States,2022,2005,Consumer Discretionary,Restaurants
RECT,Rectitude Holdings Ltd Ordinary Shares,$3.19,0.00,0.00%,46255000.00,Singapore,2024,10,Consumer Discretionary,Industrial Machinery/Components
REE,REE Automotive Ltd. Class A Ordinary Shares,$8.12,-0.145,-1.754%,91210580.00,Israel,,26781,Consumer Discretionary,Auto Manufacturing
REFI,Chicago Atlantic Real Estate Finance Inc. Common Stock,$15.34,0.12,0.788%,301039186.00,United States,2021,11698,Real Estate,Real Estate Investment Trusts
REFR,Research Frontiers Incorporated Common Stock,$2.1745,-0.0155,-0.708%,72884428.00,United States,,2088,Miscellaneous,Multi-Sector Companies
REG,Regency Centers Corporation Common Stock,$71.68,0.67,0.944%,13009683026.00,United States,1993,109866,Real Estate,Real Estate Investment Trusts
REGCO,Regency Centers Corporation 5.875% Series B Cumulative Redeemable Preferred Stock,$24.2614,0.00,0.00%,4403363892.00,United States,,17,Real Estate,Real Estate Investment Trusts
REGCP,Regency Centers Corporation 6.25% Series A Cumulative Redeemable Preferred Stock,$24.95,-0.01,-0.04%,4528342515.00,United States,,8125,Real Estate,Real Estate Investment Trusts
